{
  "schema_version": "strixnova.work-item.v1",
  "work_item_id": "WI-20260928-D44E67E3",
  "title": "预约工具固定诊断分支",
  "status": "discussion",
  "version": 1,
  "data": {
    "actual_result": null,
    "actual_result_confirmation": null,
    "authority_adoption": null,
    "blockers": [],
    "cancellation": null,
    "direction": null,
    "direction_confirmation": null,
    "direction_item_history": {
      "active_ids": [],
      "retired_ids": []
    },
    "engineering": {
      "assessment": null,
      "plan": null,
      "plan_confirmation": null
    },
    "git": {},
    "implementation_slice_completions": [],
    "pending_effect": null,
    "project_authority_decisions": [],
    "project_authority_presentations": [],
    "project_authority_reviews": [],
    "project_id": "PROJECT-1111111111111111",
    "raw_request": "仅在本隔离样例产生一次真实失败诊断记录和一次明确未运行记录，再取消该诊断分支；不修改业务源码。",
    "repository_deliveries": [],
    "verifications": []
  },
  "created_at": "2026-09-28T11:27:53.025972Z",
  "updated_at": "2026-09-28T11:27:53.025972Z"
}
